<?xml version="1.0" encoding="UTF-8"?>

<control_graph
xmlns:xsi="http://www.w3.org/2001/XMLSchema-instance"
xsi:schemaLocation="control_graph.xsd">

<root root_name="node_sequential_1"/>

<node_sequential   node_name="node_sequential_1" start_policy="any_predecessor_done" next_node_name="">
    <run_plp plp_name="move_forward" wait_time="0"></run_plp>
    <run_plp plp_name="move_forward" wait_time="0"></run_plp>
    <run_plp plp_name="move_forward" wait_time="0"></run_plp>
    <run_plp plp_name="move_forward" wait_time="0"></run_plp>
    <run_plp plp_name="move_forward" wait_time="0"></run_plp>
    <run_plp plp_name="move_forward" wait_time="0"></run_plp>
    <run_plp plp_name="move_forward" wait_time="0"></run_plp>
    <run_plp plp_name="move_forward" wait_time="0"></run_plp>
    <run_plp plp_name="move_forward" wait_time="0"></run_plp>
    <run_plp plp_name="move_forward" wait_time="0"></run_plp>
    <run_plp plp_name="move_forward" wait_time="0"></run_plp>
    <run_plp plp_name="move_forward" wait_time="0"></run_plp>
    <run_plp plp_name="move_forward" wait_time="0"></run_plp>
    <run_plp plp_name="move_forward" wait_time="0"></run_plp>
    <run_plp plp_name="move_forward" wait_time="0"></run_plp>
    <run_plp plp_name="move_forward" wait_time="0"></run_plp>
    <run_plp plp_name="move_forward" wait_time="0"></run_plp>
    <run_plp plp_name="move_forward" wait_time="0"></run_plp>
    <run_plp plp_name="move_forward" wait_time="0"></run_plp>
    <run_plp plp_name="move_forward" wait_time="0"></run_plp>
    <run_plp plp_name="move_forward" wait_time="0"></run_plp>
    <run_plp plp_name="move_forward" wait_time="0"></run_plp>
    <run_plp plp_name="move_forward" wait_time="0"></run_plp>
    <run_plp plp_name="move_forward" wait_time="0"></run_plp>
    <run_plp plp_name="move_forward" wait_time="0"></run_plp>
    <run_plp plp_name="move_forward" wait_time="0"></run_plp>
    <run_plp plp_name="move_forward" wait_time="0"></run_plp>
    <run_plp plp_name="move_forward" wait_time="0"></run_plp>
    <run_plp plp_name="move_forward" wait_time="0"></run_plp>
    <run_plp plp_name="move_forward" wait_time="0"></run_plp>
    <run_plp plp_name="move_forward" wait_time="0"></run_plp>
    <run_plp plp_name="move_forward" wait_time="0"></run_plp>
    <run_plp plp_name="move_forward" wait_time="0"></run_plp>
    <run_plp plp_name="move_forward" wait_time="0"></run_plp>
    <run_plp plp_name="move_forward" wait_time="0"></run_plp>
    <run_plp plp_name="move_forward" wait_time="0"></run_plp>
    <run_plp plp_name="move_forward" wait_time="0"></run_plp>
    <run_plp plp_name="move_forward" wait_time="0"></run_plp>
    <run_plp plp_name="move_forward" wait_time="0"></run_plp>
    <run_plp plp_name="move_forward" wait_time="0"></run_plp>
    <run_plp plp_name="move_forward" wait_time="0"></run_plp>
    <run_plp plp_name="move_forward" wait_time="0"></run_plp>
    <run_plp plp_name="move_forward" wait_time="0"></run_plp>
    <run_plp plp_name="move_forward" wait_time="0"></run_plp>
    <run_plp plp_name="move_forward" wait_time="0"></run_plp>
    <run_plp plp_name="move_forward" wait_time="0"></run_plp>
    <run_plp plp_name="move_forward" wait_time="0"></run_plp>
    <run_plp plp_name="move_forward" wait_time="0"></run_plp>
    <run_plp plp_name="move_forward" wait_time="0"></run_plp>
    <run_plp plp_name="move_forward" wait_time="0"></run_plp>
    <run_plp plp_name="move_forward" wait_time="0"></run_plp>
    <run_plp plp_name="move_forward" wait_time="0"></run_plp>
    <run_plp plp_name="move_forward" wait_time="0"></run_plp>
    <run_plp plp_name="move_forward" wait_time="0"></run_plp>
    <run_plp plp_name="move_forward" wait_time="0"></run_plp>
    <run_plp plp_name="move_forward" wait_time="0"></run_plp>
    <run_plp plp_name="move_forward" wait_time="0"></run_plp>
    <run_plp plp_name="move_forward" wait_time="0"></run_plp>
    <run_plp plp_name="move_forward" wait_time="0"></run_plp>
    <run_plp plp_name="move_forward" wait_time="0"></run_plp>
    <run_plp plp_name="move_forward" wait_time="0"></run_plp>
    <run_plp plp_name="move_forward" wait_time="0"></run_plp>
    <run_plp plp_name="move_forward" wait_time="0"></run_plp>
    <run_plp plp_name="move_forward" wait_time="0"></run_plp>
    <run_plp plp_name="move_forward" wait_time="0"></run_plp>
    <run_plp plp_name="move_forward" wait_time="0"></run_plp>
    <run_plp plp_name="move_forward" wait_time="0"></run_plp>
    <run_plp plp_name="move_forward" wait_time="0"></run_plp>
    <run_plp plp_name="move_forward" wait_time="0"></run_plp>
    <run_plp plp_name="move_forward" wait_time="0"></run_plp>
    <run_plp plp_name="move_forward" wait_time="0"></run_plp>
    <run_plp plp_name="move_forward" wait_time="0"></run_plp>
    <run_plp plp_name="move_forward" wait_time="0"></run_plp>
    <run_plp plp_name="move_forward" wait_time="0"></run_plp>
    <run_plp plp_name="move_forward" wait_time="0"></run_plp>
    <run_plp plp_name="move_forward" wait_time="0"></run_plp>
    <run_plp plp_name="move_forward" wait_time="0"></run_plp>
    <run_plp plp_name="move_forward" wait_time="0"></run_plp>
    <run_plp plp_name="move_forward" wait_time="0"></run_plp>
    <run_plp plp_name="move_forward" wait_time="0"></run_plp>
    <run_plp plp_name="move_forward" wait_time="0"></run_plp>
    <run_plp plp_name="move_forward" wait_time="0"></run_plp>
    <run_plp plp_name="move_forward" wait_time="0"></run_plp>
    <run_plp plp_name="move_forward" wait_time="0"></run_plp>
    <run_plp plp_name="move_forward" wait_time="0"></run_plp>
    <run_plp plp_name="move_forward" wait_time="0"></run_plp>
    <run_plp plp_name="move_forward" wait_time="0"></run_plp>
    <run_plp plp_name="move_forward" wait_time="0"></run_plp>
    <run_plp plp_name="move_forward" wait_time="0"></run_plp>
    <run_plp plp_name="move_forward" wait_time="0"></run_plp>
    <run_plp plp_name="move_forward" wait_time="0"></run_plp>
    <run_plp plp_name="move_forward" wait_time="0"></run_plp>
    <run_plp plp_name="move_forward" wait_time="0"></run_plp>
    <run_plp plp_name="move_forward" wait_time="0"></run_plp>
    <run_plp plp_name="move_forward" wait_time="0"></run_plp>
    <run_plp plp_name="move_forward" wait_time="0"></run_plp>
    <run_plp plp_name="move_forward" wait_time="0"></run_plp>
    <run_plp plp_name="move_forward" wait_time="0"></run_plp>
    <run_plp plp_name="move_forward" wait_time="0"></run_plp>
    <run_plp plp_name="move_forward" wait_time="0"></run_plp>
</node_sequential>


</control_graph>
