<?xml version="1.0" encoding="UTF-8"?>

<control_graph
xmlns:xsi="http://www.w3.org/2001/XMLSchema-instance"
xsi:schemaLocation="control_graph.xsd">

<root root_name="node_concurrent_1"/>

<node_concurrent   node_name="node_concurrent_1" start_policy="any_predecessor_done" wait_time="3">
    <update>
        <formula_condition key_description="free_path">
          <expression value="_maintain_direction_on_map_2_param_path_free" />
          <operator type="=" />
          <expression value="TRUE" />
        </formula_condition>
    </update>
    <update>
        <formula_condition key_description="free_path">
          <expression value="_maintain_direction_on_map_param_path_free" />
          <operator type="=" />
          <expression value="TRUE" />
        </formula_condition>
    </update>
    <run_node node_name="node_sequential_1"/>
    <run_node node_name="node_sequential_2"/>
</node_concurrent>

<node_sequential   node_name="node_sequential_1" start_policy="any_predecessor_done" >
    <run_plp plp_name="maintain_direction_on_map" wait_time="1"></run_plp>
</node_sequential>

<node_sequential   node_name="node_sequential_2" start_policy="any_predecessor_done">
    <run_plp plp_name="maintain_direction_on_map_2" wait_time="1"></run_plp>
</node_sequential>

</control_graph>
