<?xml version="1.0" encoding="UTF-8"?>

<control_graph
xmlns:xsi="http://www.w3.org/2001/XMLSchema-instance"
xsi:schemaLocation="control_graph.xsd">

<root root_name="node_sequential_start"/>

<node_sequential   node_name="node_sequential_start" start_policy="any_predecessor_done" next_node_name="node_concurrent_1">
    <run_plp plp_name="achieve_move_to">
        <update>
          <formula_condition key_description="update variables">
            <expression value="_achieve_move_to_destination" />
            <operator type="="/>
            <expression value="at_a_key" />
          </formula_condition>
        </update>
    </run_plp>
    <run_plp plp_name="achieve_key_take" wait_time="1">
    </run_plp>
</node_sequential>

<node_concurrent   node_name="node_concurrent_1" start_policy="any_predecessor_done">
    <run_node node_name="node_sequential_key_holding"/>
    <run_node node_name="node_sequential_move_to_door"/>
</node_concurrent>

<node_sequential   node_name="node_sequential_key_holding" start_policy="any_predecessor_done" next_node_name="">
    <run_plp plp_name="maintain_key_hold">
    </run_plp>
</node_sequential>

<node_sequential   node_name="node_sequential_move_to_door" start_policy="any_predecessor_done" next_node_name="">
    <run_plp plp_name="achieve_move_to">
        <update>
          <formula_condition key_description="update variables">
            <expression value="_achieve_move_to_destination" />
            <operator type="="/>
            <expression value="at_a_key" />
          </formula_condition>
        </update>
    </run_plp>
    <run_plp plp_name="observe_is_door_open">
    </run_plp>
</node_sequential>

</control_graph>
