<?xml version="1.0" encoding="UTF-8"?>

<control_graph
xmlns:xsi="http://www.w3.org/2001/XMLSchema-instance"
xsi:schemaLocation="control_graph.xsd">

<root root_name="node_sequential_00001"/><node_sequential   node_name="node_sequential_00001" start_policy="any_predecessor_done" next_node_name="node_sequential_00002">
    <run_plp plp_name="move_forward_00001" wait_time="0"></run_plp>
</node_sequential>
<node_sequential   node_name="node_sequential_00002" start_policy="any_predecessor_done" next_node_name="node_sequential_00003">
    <run_plp plp_name="move_forward_00002" wait_time="0"></run_plp>
</node_sequential>
<node_sequential   node_name="node_sequential_00003" start_policy="any_predecessor_done" next_node_name="node_sequential_00004">
    <run_plp plp_name="move_forward_00003" wait_time="0"></run_plp>
</node_sequential>
<node_sequential   node_name="node_sequential_00004" start_policy="any_predecessor_done" next_node_name="node_sequential_00005">
    <run_plp plp_name="move_forward_00004" wait_time="0"></run_plp>
</node_sequential>
<node_sequential   node_name="node_sequential_00005" start_policy="any_predecessor_done" next_node_name="node_sequential_00006">
    <run_plp plp_name="move_forward_00005" wait_time="0"></run_plp>
</node_sequential>
<node_sequential   node_name="node_sequential_00006" start_policy="any_predecessor_done" next_node_name="node_sequential_00007">
    <run_plp plp_name="move_forward_00006" wait_time="0"></run_plp>
</node_sequential>
<node_sequential   node_name="node_sequential_00007" start_policy="any_predecessor_done" next_node_name="node_sequential_00008">
    <run_plp plp_name="move_forward_00007" wait_time="0"></run_plp>
</node_sequential>
<node_sequential   node_name="node_sequential_00008" start_policy="any_predecessor_done" next_node_name="node_sequential_00009">
    <run_plp plp_name="move_forward_00008" wait_time="0"></run_plp>
</node_sequential>
<node_sequential   node_name="node_sequential_00009" start_policy="any_predecessor_done" next_node_name="node_sequential_00010">
    <run_plp plp_name="move_forward_00009" wait_time="0"></run_plp>
</node_sequential>
<node_sequential   node_name="node_sequential_00010" start_policy="any_predecessor_done" next_node_name="">
    <run_plp plp_name="move_forward_00010" wait_time="0"></run_plp>
</node_sequential>
</control_graph>
